{
  "title": "Пульс команды: аналитика нагрузки для продуктовых команд",
  "purpose": "product",
  "audience": "руководители продуктовых направлений",
  "language": "ru",
  "slides": [
    {
      "idx": 0,
      "archetype": "title",
      "title": "Пульс команды: перегрузка видна за неделю, а не за квартал",
      "subtitle": "Итоги пилота в 12 командах и план запуска · сентябрь 2026",
      "speaker_notes": "Представиться, обозначить цель: решение по запуску на все продуктовые команды.",
      "sources": ["brief"]
    },
    {
      "idx": 1,
      "archetype": "bullets",
      "section": "Контекст",
      "title": "Команды теряют до трети времени на согласования, и руководитель этого не видит",
      "bullets": [
        "Статусы вместо работы — до 9,5 часов в неделю на человека уходит на встречи и отчёты",
        "Перегрузка скрыта — трекер показывает задачи, а не людей, которые ими завалены",
        "Поздние сигналы — о выгорании узнают на ретро или при увольнении",
        "Ручные отчёты — лиды собирают статусы вручную, данные устаревают за день",
        "Спор об ощущениях — на ретро обсуждают впечатления, а не факты",
        "Нет общей картины — у смежных команд разные представления о приоритетах"
      ],
      "speaker_notes": "Шесть причин из интервью с лидами перед пилотом.",
      "sources": ["brief", "m:coordination_hours"]
    },
    {
      "idx": 2,
      "archetype": "kpi",
      "section": "Контекст",
      "title": "Каждая вторая команда перегружена хотя бы неделю в месяц",
      "kpis": [
        {"value": "42 %", "label": "перегруженных команд"},
        {"value": "12", "label": "команд в пилоте"},
        {"value": "1,8 дня", "label": "срок ответа на запрос"},
        {"value": "4,7", "label": "оценка пилота (из 5)"}
      ],
      "sources": ["m:overload_share", "m:pilot", "m:response_days", "m:score"]
    },
    {
      "idx": 3,
      "archetype": "process",
      "section": "Решение",
      "title": "От подключения до ретро с данными — пять шагов за один месяц",
      "steps": [
        "Подключение — трекер задач и календарь через OAuth за 15 минут",
        "Сбор сигналов — сроки, статусы, участники и длительность встреч, без чтения содержимого",
        "Модель нагрузки — оценка перегрузки на человека и на команду",
        "Еженедельный дайджест — три риска и три рекомендации лиду",
        "Ретро с данными — обсуждение по фактам, а не по ощущениям"
      ],
      "sources": ["brief"]
    },
    {
      "idx": 4,
      "archetype": "bullets",
      "section": "Решение",
      "title": "Лид получает риски заранее, команда — меньше встреч",
      "bullets": [
        "Риски заранее — дайджест приходит в понедельник, до планирования недели",
        "Меньше статусов — отчёты собираются автоматически из трекера и календаря",
        "Честное ретро — команда обсуждает цифры, а не впечатления",
        "Приватность — сервис видит метаданные, но не содержимое задач и переписки"
      ],
      "sources": ["brief"]
    },
    {
      "idx": 5,
      "archetype": "chart",
      "section": "Доказательства",
      "title": "Время на согласования в пилотных командах упало на 45 % за четыре месяца",
      "chart": {
        "kind": "line",
        "title": "Время на согласования и статусы, часов в неделю на человека",
        "categories": ["Май", "Июнь", "Июль", "Август"],
        "series": {"Пилотные команды": [9.5, 7.1, 5.8, 5.2], "Контрольная группа": [9.3, 9.6, 9.1, 9.4]},
        "unit": "ч/нед",
        "y_label": "ч/нед"
      },
      "speaker_notes": "Контрольная группа — 8 команд без сервиса за тот же период.",
      "sources": ["m:coordination_hours"]
    },
    {
      "idx": 6,
      "archetype": "table",
      "section": "Доказательства",
      "title": "Доля разработки в рабочем времени выросла с 38 до 54 %",
      "table": {
        "header": ["Тип работы", "До пилота", "После пилота", "Изменение"],
        "rows": [
          ["Согласования", "31", "17", "−14 п.п."],
          ["Статусы и отчёты", "18", "9", "−9 п.п."],
          ["Разработка и дизайн", "38", "54", "+16 п.п."],
          ["Прочее", "13", "20", "+7 п.п."]
        ]
      },
      "sources": ["m:time_structure"]
    },
    {
      "idx": 7,
      "archetype": "quote",
      "section": "Доказательства",
      "title": "Команды перестали спорить о том, куда уходит время",
      "quote": "За месяц мы впервые увидели, где реально теряется время, — и перестали спорить об этом на ретро",
      "quote_author": "Руководитель разработки, команда платёжного шлюза",
      "sources": ["m:quote"]
    },
    {
      "idx": 8,
      "archetype": "bullets",
      "section": "План",
      "title": "Три риска запуска закрываются политикой доступа и поэтапным подключением",
      "bullets": [
        "Недоверие команд — доступ только к метаданным, отчёт видит сама команда раньше руководителя",
        "Нагрузка на инфраструктуру — подключение волнами по 20 команд в месяц",
        "Ложные тревоги — порог перегрузки калибруется по первым двум неделям каждой команды"
      ],
      "sources": ["brief"]
    },
    {
      "idx": 9,
      "archetype": "bullets",
      "section": "План",
      "title": "К концу квартала сервис работает во всех продуктовых командах",
      "bullets": [
        "Октябрь — подключение первых 20 команд и политика доступа",
        "Ноябрь — ещё 40 команд, интеграция с системой целей",
        "Декабрь — все продуктовые команды, отчёт для руководителей направлений"
      ],
      "sources": ["brief"]
    },
    {
      "idx": 10,
      "archetype": "closing",
      "title": "Спасибо!",
      "subtitle": "Готовы подключить вашу команду за один день",
      "bullets": ["pulse-team@example.com"],
      "sources": ["brief"]
    }
  ]
}
