{
 "title": "VK Tech: IT-решения для бизнеса",
 "purpose": "product",
 "audience": "IT-директора и руководители корпоративных клиентов",
 "language": "ru",
 "slides": [
  {
   "idx": 0,
   "archetype": "title",
   "title": "VK Tech: IT-решения для бизнеса",
   "subtitle": "Безопасность, инфраструктура и сервис для цифровой трансформации",
   "section": "Титул",
   "bullets": [],
   "paragraphs": [],
   "kpis": [],
   "chart": null,
   "table": null,
   "image": null,
   "steps": [],
   "diagram": null,
   "quote": null,
   "quote_author": null,
   "speaker_notes": "",
   "sources": [
    "brief"
   ]
  },
  {
   "idx": 1,
   "archetype": "cards",
   "title": "Цифровая трансформация требует надежной технологической основы",
   "subtitle": null,
   "section": "Вызовы",
   "bullets": [
    "Надежность — Стабильная работа систем критически важна для непрерывности бизнеса.",
    "Безопасность — Защита данных и инфраструктуры от внешних угроз.",
    "Эффективность — Снижение операционных рисков и повышение продуктивности процессов."
   ],
   "paragraphs": [],
   "kpis": [],
   "chart": null,
   "table": null,
   "image": null,
   "steps": [],
   "diagram": null,
   "quote": null,
   "quote_author": null,
   "speaker_notes": "",
   "sources": [
    "brief"
   ]
  },
  {
   "idx": 2,
   "archetype": "image_text",
   "title": "VK Tech разрабатывает корпоративное ПО по строгим стандартам",
   "subtitle": null,
   "section": "Решение",
   "bullets": [],
   "paragraphs": [
    "Мы создаем комплексные IT-решения, соответствующие международным стандартам безопасности. Архитектура обеспечивает защиту корпоративной инфраструктуры и соответствие регуляторным требованиям."
   ],
   "kpis": [],
   "chart": null,
   "table": null,
   "image": null,
   "steps": [],
   "diagram": null,
   "quote": null,
   "quote_author": null,
   "speaker_notes": "",
   "sources": [
    "brief"
   ]
  },
  {
   "idx": 3,
   "archetype": "cards",
   "title": "Архитектура решений обеспечивает масштабируемость и защиту",
   "subtitle": null,
   "section": "Решение",
   "bullets": [
    "Масштабируемость — Гибкое расширение функциональности под рост бизнеса.",
    "Защита — Многоуровневая безопасность данных и сетевой инфраструктуры.",
    "Интеграция — Соединение с существующими корпоративными системами."
   ],
   "paragraphs": [],
   "kpis": [],
   "chart": null,
   "table": null,
   "image": null,
   "steps": [],
   "diagram": null,
   "quote": null,
   "quote_author": null,
   "speaker_notes": "",
   "sources": [
    "brief"
   ]
  },
  {
   "idx": 4,
   "archetype": "image_text",
   "title": "Интеграция сервисов автоматизирует ключевые бизнес-процессы",
   "subtitle": null,
   "section": "Решение",
   "bullets": [],
   "paragraphs": [
    "Наши решения позволяют автоматизировать рутинные операции, снижая нагрузку на сотрудников и минимизируя риск человеческих ошибок в критических процессах."
   ],
   "kpis": [],
   "chart": null,
   "table": null,
   "image": null,
   "steps": [],
   "diagram": null,
   "quote": null,
   "quote_author": null,
   "speaker_notes": "",
   "sources": [
    "brief"
   ]
  },
  {
   "idx": 5,
   "archetype": "cards",
   "title": "Решения адаптируются под требования отраслей и масштабов",
   "subtitle": null,
   "section": "Решение",
   "bullets": [
    "Гибкость — Настройка под специфические потребности различных отраслей.",
    "Масштаб — Поддержка как малого бизнеса, так и крупных корпораций.",
    "Кастомизация — Учет уникальных бизнес-процессов клиента."
   ],
   "paragraphs": [],
   "kpis": [],
   "chart": null,
   "table": null,
   "image": null,
   "steps": [],
   "diagram": null,
   "quote": null,
   "quote_author": null,
   "speaker_notes": "",
   "sources": [
    "brief"
   ]
  },
  {
   "idx": 6,
   "archetype": "process",
   "title": "Внедрение проходит поэтапно: от аудита до поддержки",
   "subtitle": null,
   "section": "Процесс",
   "bullets": [],
   "paragraphs": [],
   "kpis": [],
   "chart": null,
   "table": null,
   "image": null,
   "steps": [
    "Аудит — Анализ текущих процессов и инфраструктуры.",
    "Проектирование — Разработка архитектуры и плана внедрения.",
    "Внедрение — Установка, настройка и интеграция решений.",
    "Запуск — Переход на новые процессы и обучение.",
    "Поддержка — Сервисное обслуживание и развитие."
   ],
   "diagram": null,
   "quote": null,
   "quote_author": null,
   "speaker_notes": "",
   "sources": [
    "brief"
   ]
  },
  {
   "idx": 7,
   "archetype": "cards",
   "title": "Защищенность данных соответствует международным стандартам",
   "subtitle": null,
   "section": "Безопасность",
   "bullets": [
    "Стандарты — Соответствие глобальным требованиям к безопасности данных.",
    "Шифрование — Защита информации при передаче и хранении.",
    "Контроль — Мониторинг доступа и действий пользователей."
   ],
   "paragraphs": [],
   "kpis": [],
   "chart": null,
   "table": null,
   "image": null,
   "steps": [],
   "diagram": null,
   "quote": null,
   "quote_author": null,
   "speaker_notes": "",
   "sources": [
    "brief"
   ]
  },
  {
   "idx": 8,
   "archetype": "cards",
   "title": "Гибкая модель обслуживания включает полный цикл поддержки",
   "subtitle": null,
   "section": "Сервис",
   "bullets": [
    "Тестирование — Проверка стабильности и функциональности систем.",
    "Логистика — Организация поставок и развертывания оборудования.",
    "Сервис — Оперативная техническая поддержка и консультации."
   ],
   "paragraphs": [],
   "kpis": [],
   "chart": null,
   "table": null,
   "image": null,
   "steps": [],
   "diagram": null,
   "quote": null,
   "quote_author": null,
   "speaker_notes": "",
   "sources": [
    "brief"
   ]
  },
  {
   "idx": 9,
   "archetype": "image_text",
   "title": "Комплексные решения снижают операционные риски",
   "subtitle": null,
   "section": "Результаты",
   "bullets": [],
   "paragraphs": [
    "Использование единой экосистемы VK Tech минимизирует уязвимости, связанные с разрозненными системами, и повышает общую эффективность бизнес-процессов."
   ],
   "kpis": [],
   "chart": null,
   "table": null,
   "image": null,
   "steps": [],
   "diagram": null,
   "quote": null,
   "quote_author": null,
   "speaker_notes": "",
   "sources": [
    "brief"
   ]
  },
  {
   "idx": 10,
   "archetype": "cards",
   "title": "Следующий шаг — обсуждение деталей и приоритетов",
   "subtitle": null,
   "section": "Дальнейшие шаги",
   "bullets": [
    "Консультация — Обсуждение текущих задач и целей проекта.",
    "План — Определение приоритетных направлений развития.",
    "Старт — Запуск пилотного этапа или полного внедрения."
   ],
   "paragraphs": [],
   "kpis": [],
   "chart": null,
   "table": null,
   "image": null,
   "steps": [],
   "diagram": null,
   "quote": null,
   "quote_author": null,
   "speaker_notes": "",
   "sources": [
    "brief"
   ]
  },
  {
   "idx": 11,
   "archetype": "closing",
   "title": "Спасибо за внимание",
   "subtitle": null,
   "section": "Финал",
   "bullets": [],
   "paragraphs": [
    "Готовы обсудить детали вашего проекта. Свяжитесь с нами для начала сотрудничества."
   ],
   "kpis": [],
   "chart": null,
   "table": null,
   "image": null,
   "steps": [],
   "diagram": null,
   "quote": null,
   "quote_author": null,
   "speaker_notes": "",
   "sources": [
    "brief"
   ]
  }
 ]
}