{
 "title": "VK Tech: корпоративные ИТ-решения",
 "purpose": "product",
 "audience": "ИТ-директора и руководители корпоративных проектов",
 "language": "ru",
 "slides": [
  {
   "idx": 0,
   "archetype": "title",
   "title": "VK Tech: корпоративные ИТ-решения",
   "subtitle": "Архитектура, безопасность и внедрение",
   "section": "",
   "bullets": [],
   "paragraphs": [],
   "kpis": [],
   "chart": null,
   "table": null,
   "image": null,
   "steps": [],
   "diagram": null,
   "quote": null,
   "quote_author": null,
   "speaker_notes": "",
   "sources": [
    "brief"
   ]
  },
  {
   "idx": 1,
   "archetype": "cards",
   "title": "Устаревание инфраструктуры усложняет управление ИТ",
   "subtitle": null,
   "section": "Проблема",
   "bullets": [
    "Сложность — Растущая сложность управления корпоративными ИТ-системами",
    "Устаревание — Устаревание инфраструктуры снижает эффективность",
    "Фрагментация — Отсутствие единой цифровой среды для процессов"
   ],
   "paragraphs": [],
   "kpis": [],
   "chart": null,
   "table": null,
   "image": null,
   "steps": [],
   "diagram": null,
   "quote": null,
   "quote_author": null,
   "speaker_notes": "",
   "sources": [
    "brief"
   ]
  },
  {
   "idx": 2,
   "archetype": "image_text",
   "title": "Единая среда обеспечивает прозрачность и управляемость",
   "subtitle": null,
   "section": "Проблема",
   "bullets": [],
   "paragraphs": [
    "Бизнес-процессы требуют единой цифровой среды. Это обеспечивает прозрачность и управляемость операций."
   ],
   "kpis": [],
   "chart": null,
   "table": null,
   "image": null,
   "steps": [],
   "diagram": null,
   "quote": null,
   "quote_author": null,
   "speaker_notes": "",
   "sources": [
    "brief"
   ]
  },
  {
   "idx": 3,
   "archetype": "cards",
   "title": "VK Tech: комплексная платформа для ИТ-операций",
   "subtitle": null,
   "section": "Решение",
   "bullets": [
    "Автоматизация — Автоматизация корпоративных ИТ-операций",
    "Масштабируемость — Гибкая архитектура под задачи любого уровня",
    "Интеграция — Поддержка интеграции с существующими системами"
   ],
   "paragraphs": [],
   "kpis": [],
   "chart": null,
   "table": null,
   "image": null,
   "steps": [],
   "diagram": null,
   "quote": null,
   "quote_author": null,
   "speaker_notes": "",
   "sources": [
    "brief"
   ]
  },
  {
   "idx": 4,
   "archetype": "image_text",
   "title": "Архитектура обеспечивает масштабируемость и гибкость",
   "subtitle": null,
   "section": "Решение",
   "bullets": [],
   "paragraphs": [
    "Архитектура решения обеспечивает масштабируемость. Она гибко адаптируется под задачи любого уровня."
   ],
   "kpis": [],
   "chart": null,
   "table": null,
   "image": null,
   "steps": [],
   "diagram": null,
   "quote": null,
   "quote_author": null,
   "speaker_notes": "",
   "sources": [
    "brief"
   ]
  },
  {
   "idx": 5,
   "archetype": "cards",
   "title": "Безопасность соответствует современным стандартам защиты",
   "subtitle": null,
   "section": "Безопасность",
   "bullets": [
    "Стандарты — Соответствие современным стандартам защиты данных",
    "Защищенность — Высокий уровень защищенности инфраструктуры",
    "Ключевое отличие — Безопасность — ключевое отличие решения"
   ],
   "paragraphs": [],
   "kpis": [],
   "chart": null,
   "table": null,
   "image": null,
   "steps": [],
   "diagram": null,
   "quote": null,
   "quote_author": null,
   "speaker_notes": "",
   "sources": [
    "brief"
   ]
  },
  {
   "idx": 6,
   "archetype": "image_text",
   "title": "Интеграция с существующими корпоративными системами",
   "subtitle": null,
   "section": "Интеграция",
   "bullets": [],
   "paragraphs": [
    "Решение поддерживает интеграцию с существующими системами. Обеспечивает совместимость с корпоративными сервисами."
   ],
   "kpis": [],
   "chart": null,
   "table": null,
   "image": null,
   "steps": [],
   "diagram": null,
   "quote": null,
   "quote_author": null,
   "speaker_notes": "",
   "sources": [
    "brief"
   ]
  },
  {
   "idx": 7,
   "archetype": "cards",
   "title": "Автоматизация снижает операционные затраты",
   "subtitle": null,
   "section": "Ценность",
   "bullets": [
    "Автоматизация — Автоматизация рутинных ИТ-задач",
    "Экономия — Снижение операционных затрат",
    "Скорость — Сокращение времени вывода сервисов на рынок"
   ],
   "paragraphs": [],
   "kpis": [],
   "chart": null,
   "table": null,
   "image": null,
   "steps": [],
   "diagram": null,
   "quote": null,
   "quote_author": null,
   "speaker_notes": "",
   "sources": [
    "brief"
   ]
  },
  {
   "idx": 8,
   "archetype": "process",
   "title": "Внедрение: от аудита до масштабирования",
   "subtitle": null,
   "section": "Внедрение",
   "bullets": [],
   "paragraphs": [],
   "kpis": [],
   "chart": null,
   "table": null,
   "image": null,
   "steps": [
    "Аудит",
    "Настройка",
    "Пилотный запуск",
    "Масштабирование"
   ],
   "diagram": null,
   "quote": null,
   "quote_author": null,
   "speaker_notes": "",
   "sources": [
    "brief"
   ]
  },
  {
   "idx": 9,
   "archetype": "cards",
   "title": "Поддержка гарантирует стабильность платформы",
   "subtitle": null,
   "section": "Поддержка",
   "bullets": [
    "Сопровождение — Сервисное сопровождение платформы",
    "Стабильность — Гарантия стабильности работы",
    "Целевая аудитория — Для средних и крупных компаний"
   ],
   "paragraphs": [],
   "kpis": [],
   "chart": null,
   "table": null,
   "image": null,
   "steps": [],
   "diagram": null,
   "quote": null,
   "quote_author": null,
   "speaker_notes": "",
   "sources": [
    "brief"
   ]
  },
  {
   "idx": 10,
   "archetype": "image_text",
   "title": "Демонстрация платформы на вашей инфраструктуре",
   "subtitle": null,
   "section": "Следующий шаг",
   "bullets": [],
   "paragraphs": [
    "Следующий шаг — демонстрация платформы. Покажем работу решения на вашей инфраструктуре."
   ],
   "kpis": [],
   "chart": null,
   "table": null,
   "image": null,
   "steps": [],
   "diagram": null,
   "quote": null,
   "quote_author": null,
   "speaker_notes": "",
   "sources": [
    "brief"
   ]
  },
  {
   "idx": 11,
   "archetype": "closing",
   "title": "Спасибо за внимание",
   "subtitle": null,
   "section": "",
   "bullets": [],
   "paragraphs": [],
   "kpis": [],
   "chart": null,
   "table": null,
   "image": null,
   "steps": [],
   "diagram": null,
   "quote": null,
   "quote_author": null,
   "speaker_notes": "",
   "sources": [
    "brief"
   ]
  }
 ]
}